{
  "baseline_run_id": "finite-before",
  "catalog_digest": "sha256:2630bb2c3d4c714c40aa3b72f9f079030f205e4a0f271fb2220cd6651e92cc77",
  "catalog_id": "ad-remediation/1.0.0",
  "conflict_policy": "reject_duplicate_or_conflicting_keys",
  "edits": [
    {
      "catalog_entry_id": "admin-revoke",
      "edge_id": "sha256:8f30ade289c16f75c747c8651362d8483c3ac7793c5a3f47b769fcbf110fca67",
      "edit_id": "remove-direct-admin",
      "effective_right_verified": true,
      "evidence_refs": [
        "synthetic://golden/two-routes"
      ],
      "kind": "deny_relationship",
      "provenance_digest": "sha256:bc4376c8d50f09eb344b1cd8a92ef7d6285d52963b46cd885b335cd46db6c072",
      "rationale": "Synthetic effective authorization removal, all support bound",
      "relationship": {
        "kind": "AdminTo",
        "source": "S-1-5-21-1000-2000-3000-1101",
        "target": "10000000-0000-4000-8000-000000000002"
      }
    }
  ],
  "initial_state_policy": "rebuild_same_declared_foothold",
  "missing_evidence_policy": "unresolved_no_effect_claim",
  "request_id": "finite-acl",
  "schema_version": "1.1.0",
  "scope": {
    "engine_revision": "7368cac505b3d19331cb8a688114107e91134f25",
    "evaluation_mode": "scenario",
    "goal_manifest_digest": "sha256:873d490956608e24dbdc2b35882bc7867f793d902a4c189c0f6f29278cd0ed80",
    "graph_digest": "sha256:73c151a00a0ae3a334b16d2d2ac5eb4b714e10b9239bae391e7a470b7a79e08c",
    "program_identity_version": "semantic-program/1",
    "query_profile_digest": "sha256:06697ea478fdbd67d8ef4d9390c544638c59c91c1cca1741dac54e2e9194e138",
    "rating_inputs_digest": "sha256:74234e98afe7498fb5daf1f36ac2d78acc339464f950703b8c019892f982b90b",
    "route_identity_version": "ordered-observed-edges/1",
    "search_budget": {
      "max_expansions": 1000,
      "max_paths": 100,
      "max_steps": 6
    },
    "semantic_catalog_digest": "sha256:73d46a1d077870379e3fcc40ae5883acbb46e8160c86bb627b9dfc04a5d4d241",
    "snapshot_facts_digest": "sha256:4f53cda18c2baa0c0354bb5f9a3ecbe5ed12ab4d8e11ba873c2f11161202b945",
    "snapshot_id": "sha256:cc6b062c65d9266268673105c46c9b0ec199a17fedb70cb3ab64407361c389d3",
    "source_manifest_digest": "sha256:3bd9b7ea5ad83ec19bd3e99b985b0865d2a75d47dbf5907f5e65a5d75d4b4343"
  }
}
